{
  "$schema": "http://json-schema.org/draft-07/schema#",
  "$id": "https://hakoniwa-lab.net/schemas/hakoniwa-pdu-bridge-config-2.0.0.schema.json",
  "title": "Hakoniwa PDU Bridge Config",
  "type": "object",
  "additionalProperties": false,
  "required": [
    "version",
    "transferPolicies",
    "nodes",
    "pduKeyGroups",
    "connections"
  ],

  "properties": {
    "version": {
      "type": "string",
      "const": "2.0.0"
    },

    "transferPolicies": {
      "type": "object",
      "additionalProperties": false,
      "minProperties": 1,
      "description": "Policy instances. Keys are policy IDs (e.g., 'immediate', 'throttle1'). transferPdus[].policyId must reference one of these keys.",
      "patternProperties": {
        "^[A-Za-z][A-Za-z0-9_\\-]*$": { "$ref": "#/$defs/transferPolicy" }
      }
    },

    "nodes": {
      "type": "array",
      "minItems": 1,
      "items": { "$ref": "#/$defs/node" },
      "uniqueItems": true
    },

    "endpoints_config_path": {
      "type": "string",
      "minLength": 1,
      "description": "Optional path to endpoint_container.json used by hakoniwa-pdu-endpoint. Resolved relative to bridge.json."
    },

    "wireLinks": {
      "type": "array",
      "minItems": 0,
      "items": { "$ref": "#/$defs/wireLink" },
      "description": "Links between wire endpoints. from/to must point to endpoints whose mode is 'wire' (enforced by additional validation outside JSON Schema if needed)."
    },

    "pduKeyGroups": {
      "type": "object",
      "additionalProperties": false,
      "minProperties": 1,
      "description": "Group ID -> list of PDU keys. transferPdus[].pduKeyGroupId must reference one of these keys.",
      "patternProperties": {
        "^[A-Za-z][A-Za-z0-9_\\-]*$": {
          "type": "array",
          "minItems": 1,
          "items": { "$ref": "#/$defs/pduKey" }
        }
      }
    },

    "connections": {
      "type": "array",
      "minItems": 1,
      "items": { "$ref": "#/$defs/connection" }
    }
  },

  "$defs": {
    "id": {
      "type": "string",
      "minLength": 1,
      "pattern": "^[A-Za-z][A-Za-z0-9_\\-\\.]*$"
    },

    "node": {
      "type": "object",
      "additionalProperties": false,
      "required": ["id"],
      "properties": {
        "id": { "$ref": "#/$defs/id" }
      }
    },

    "wireLink": {
      "type": "object",
      "additionalProperties": false,
      "required": ["from", "to"],
      "properties": {
        "from": { "$ref": "#/$defs/id" },
        "to": { "$ref": "#/$defs/id" }
      }
    },

    "pduKey": {
      "type": "object",
      "additionalProperties": false,
      "required": ["id", "robot_name", "pdu_name"],
      "properties": {
        "id": {
          "$ref": "#/$defs/id",
          "description": "Globally unique key identifier (recommended), e.g. 'Robot2.camera'."
        },
        "robot_name": { "type": "string", "minLength": 1 },
        "pdu_name": { "type": "string", "minLength": 1 }
      }
    },

    "transferPolicy": {
      "type": "object",
      "additionalProperties": false,
      "required": ["type"],
      "properties": {
        "type": {
          "type": "string",
          "enum": ["immediate", "throttle", "ticker"]
        },
        "atomic": {
          "type": "boolean",
          "description": "Only valid for immediate. When true, all PDUs in a transfer group are treated as an atomic frame."
        },
        "intervalMs": {
          "type": "integer",
          "minimum": 1,
          "description": "Required for throttle/ticker. Ignored for immediate."
        }
      },
      "allOf": [
        {
          "if": { "properties": { "type": { "const": "immediate" } } },
          "then": { "not": { "required": ["intervalMs"] } }
        },
        {
          "if": {
            "properties": { "type": { "enum": ["throttle", "ticker"] } }
          },
          "then": { "required": ["intervalMs"] }
        },
        {
          "if": {
            "properties": { "type": { "enum": ["throttle", "ticker"] } }
          },
          "then": { "not": { "required": ["atomic"] } }
        }
      ]
    },

    "endpointRef": {
      "type": "object",
      "additionalProperties": false,
      "required": ["endpointId"],
      "properties": {
        "endpointId": { "$ref": "#/$defs/id" }
      },
      "description": "Reference to an endpoint by ID. Must exist in endpoint_container.json for the selected node (enforced by the loader / auxiliary validation)."
    },

    "transferPdu": {
      "type": "object",
      "additionalProperties": false,
      "required": ["pduKeyGroupId", "policyId"],
      "properties": {
        "pduKeyGroupId": { "$ref": "#/$defs/id" },
        "policyId": { "$ref": "#/$defs/id" }
      },
      "description": "pduKeyGroupId must exist in pduKeyGroups. policyId must exist in transferPolicies."
    },

    "connection": {
      "type": "object",
      "additionalProperties": false,
      "required": ["id", "nodeId", "source", "destinations", "transferPdus"],
      "properties": {
        "id": { "$ref": "#/$defs/id" },
        "nodeId": { "$ref": "#/$defs/id" },
        "source": { "$ref": "#/$defs/endpointRef" },
        "destinations": {
          "type": "array",
          "minItems": 1,
          "items": { "$ref": "#/$defs/endpointRef" }
        },
        "transferPdus": {
          "type": "array",
          "minItems": 1,
          "items": { "$ref": "#/$defs/transferPdu" }
        }
      },
      "description": "nodeId must exist in nodes. source/destinations should resolve to endpoint_container.json entries for that node."
    }
  }
}
