{
  "version": "2.0.0",
  "transferPolicies": {
    "ticker_20ms": { "type": "ticker", "intervalMs": 20 }
  },
  "nodes": [
    { "id": "web_bridge_fleets_node1" }
  ],
  "endpoints_config_path": "../endpoint/endpoint_container.json",
  "wireLinks": [],
  "pduKeyGroups": {
    "visual_state_array_dual": [
      {
        "id": "DroneVisualStatePublisher.drone_visual_state_array_0",
        "robot_name": "DroneVisualStatePublisher",
        "pdu_name": "drone_visual_state_array_0"
      },
      {
        "id": "DroneVisualStatePublisher.drone_visual_state_array_1",
        "robot_name": "DroneVisualStatePublisher",
        "pdu_name": "drone_visual_state_array_1"
      }
    ]
  },
  "connections": [
    {
      "id": "conn_visual_state_shm_to_ws",
      "nodeId": "web_bridge_fleets_node1",
      "source": { "endpointId": "bridge-shm-ep" },
      "destinations": [
        { "endpointId": "bridge-ws-ep" }
      ],
      "transferPdus": [
        { "pduKeyGroupId": "visual_state_array_dual", "policyId": "ticker_20ms" }
      ]
    }
  ]
}
