{
  "version": "2.0.0",
  "transferPolicies": {
    "immediate": { "type": "immediate" }
  },
  "nodes": [
    { "id": "node1" }
  ],
  "endpoints_config_path": "endpoints.json",
  "wireLinks": [],
  "pduKeyGroups": {
    "pdu_group1": [
      { "id": "Drone.pos", "robot_name": "Drone", "pdu_name": "pos" }
    ]
  },
  "connections": [
    {
      "id": "conn1",
      "nodeId": "node1",
      "source": { "endpointId": "n1-epSrc" },
      "destinations": [],
      "transferPdus": [
        { "pduKeyGroupId": "pdu_group1", "policyId": "immediate" }
      ]
    }
  ]
}
