{
  "version": "2.0.0",
  "transferPolicies": {
    "immediate_policy": { "type": "immediate" }
  },
  "nodes": [
    { "id": "node1" }
  ],
  "endpoints_config_path": "endpoints-immediate.json",
  "wireLinks": [],
  "pduKeyGroups": {
    "group1": [
      { "id": "Robot1.pos", "robot_name": "Robot1", "pdu_name": "pos" }
    ]
  },
  "connections": [
    {
      "id": "conn1",
      "nodeId": "node1",
      "source": { "endpointId": "node1-src" },
      "destinations": [
        { "endpointId": "node1-dst" }
      ],
      "transferPdus": [
        { "pduKeyGroupId": "group1", "policyId": "immediate_policy" }
      ]
    }
  ]
}
