{
    "version": "2.0.0",
    "transferPolicies": {
        "immediate_policy": { "type": "immediate" }
    },
    "nodes": [
        { "id": "node1" },
        { "id": "node2" }
    ],
    "endpoints_config_path": "endpoints.json",
    "wireLinks": [
        { "from": "epA_dst_wire", "to": "epB_src_wire" }
    ],
    "pduKeyGroups": {
        "pdu_group_pos": [
            { "id": "Drone.pos", "robot_name": "Drone", "pdu_name": "pos" }
        ]
    },
    "connections": [
        {
            "id": "node1_conn",
            "nodeId": "node1",
            "source": { "endpointId": "epA_src" },
            "destinations": [ { "endpointId": "epA_dst_wire" } ],
            "transferPdus": [ { "pduKeyGroupId": "pdu_group_pos", "policyId": "immediate_policy" } ]
        },
        {
            "id": "node2_conn",
            "nodeId": "node2",
            "source": { "endpointId": "epB_src_wire" },
            "destinations": [ { "endpointId": "epB_dst" } ],
            "transferPdus": [ { "pduKeyGroupId": "pdu_group_pos", "policyId": "immediate_policy" } ]
        }
    ]
}
